{"backend":"pytorch","chunk_frames":[140160],"device":"cpu","dtype":"torch.float32","generation_seconds":11.776509624905884,"packages":{"numpy":"1.26.4","onnxruntime":"1.18.0","torch":"2.3.1","torchaudio":"2.3.1","transformers":"4.51.3"},"requested_model":"FunAudioLLM/Fun-CosyVoice3-0.5B-2512","resolved_model":"CosyVoice3","revision":"29e01c4e8d000f4bcd70751be16fa94bf3d85a18","sample_rate":24000,"seed":42,"source_commit":"074ca6dc9e80a2f424f1f74b48bdd7d3fea531cc","source_dirty":true,"source_snapshot_sha512":"cb458503a18be286618033a23a3851701c7ab510cc81d79127c27faad93f85b548cce1b00928a661cb2f74ab2421d9f2b323b196d1ba4784a1973cb1163d7517","source_tree_sha512":"2a6ca2a255fc0fc4215db7544f348312429c037f01354e1a7971d04c848765e2ce55eba43a8297c9911c91b2ce6fbeda35e2e13410bc75cd79e831e74a303d39","unknown_reason":"Revision from local HF download metadata; full checkpoint hash not measured by this invocation","weight_sha512":null}
